ms-gemma/models/gemma_lora_output/checkpoint-132/trainer_state.json

{
  "best_global_step": null,
  "best_metric": null,
  "best_model_checkpoint": null,
  "epoch": 3.0,
  "eval_steps": 500,
  "global_step": 132,
  "is_hyper_param_search": false,
  "is_local_process_zero": true,
  "is_world_process_zero": true,
  "log_history": [
    {
      "entropy": 2.0653992354869843,
      "epoch": 0.22857142857142856,
      "grad_norm": 2.21875,
      "learning_rate": 0.00018,
      "loss": 3.1498153686523436,
      "mean_token_accuracy": 0.4662435673177242,
      "num_tokens": 18221.0,
      "step": 10
    },
    {
      "entropy": 1.2575375042855739,
      "epoch": 0.45714285714285713,
      "grad_norm": 1.2890625,
      "learning_rate": 0.00018524590163934427,
      "loss": 1.0839410781860352,
      "mean_token_accuracy": 0.7753908231854438,
      "num_tokens": 36458.0,
      "step": 20
    },
    {
      "entropy": 0.45106362700462344,
      "epoch": 0.6857142857142857,
      "grad_norm": 1.15625,
      "learning_rate": 0.00016885245901639346,
      "loss": 0.4975739002227783,
      "mean_token_accuracy": 0.872021958231926,
      "num_tokens": 54768.0,
      "step": 30
    },
    {
      "entropy": 0.25929164327681065,
      "epoch": 0.9142857142857143,
      "grad_norm": 0.9765625,
      "learning_rate": 0.00015245901639344262,
      "loss": 0.29391553401947024,
      "mean_token_accuracy": 0.9139997094869614,
      "num_tokens": 72759.0,
      "step": 40
    },
    {
      "entropy": 0.2149000313037481,
      "epoch": 1.1371428571428572,
      "grad_norm": 0.6875,
      "learning_rate": 0.0001360655737704918,
      "loss": 0.2400994062423706,
      "mean_token_accuracy": 0.9221025644204556,
      "num_tokens": 90192.0,
      "step": 50
    },
    {
      "entropy": 0.20530546866357327,
      "epoch": 1.3657142857142857,
      "grad_norm": 0.48828125,
      "learning_rate": 0.00011967213114754099,
      "loss": 0.2125220775604248,
      "mean_token_accuracy": 0.9229702964425087,
      "num_tokens": 108712.0,
      "step": 60
    },
    {
      "entropy": 0.19728829562664033,
      "epoch": 1.5942857142857143,
      "grad_norm": 0.46875,
      "learning_rate": 0.00010327868852459018,
      "loss": 0.19332875013351442,
      "mean_token_accuracy": 0.9203159943222999,
      "num_tokens": 127201.0,
      "step": 70
    },
    {
      "entropy": 0.19823850728571416,
      "epoch": 1.822857142857143,
      "grad_norm": 0.404296875,
      "learning_rate": 8.688524590163935e-05,
      "loss": 0.17898257970809936,
      "mean_token_accuracy": 0.9284341141581536,
      "num_tokens": 145438.0,
      "step": 80
    },
    {
      "entropy": 0.18546744684378305,
      "epoch": 2.045714285714286,
      "grad_norm": 0.4140625,
      "learning_rate": 7.049180327868853e-05,
      "loss": 0.1635496973991394,
      "mean_token_accuracy": 0.9328385515090747,
      "num_tokens": 162620.0,
      "step": 90
    },
    {
      "entropy": 0.18421741090714933,
      "epoch": 2.2742857142857145,
      "grad_norm": 0.41796875,
      "learning_rate": 5.409836065573771e-05,
      "loss": 0.1635853171348572,
      "mean_token_accuracy": 0.9296296447515487,
      "num_tokens": 180997.0,
      "step": 100
    },
    {
      "entropy": 0.17626905739307402,
      "epoch": 2.5028571428571427,
      "grad_norm": 0.365234375,
      "learning_rate": 3.7704918032786885e-05,
      "loss": 0.1589285612106323,
      "mean_token_accuracy": 0.9321847885847092,
      "num_tokens": 199134.0,
      "step": 110
    },
    {
      "entropy": 0.16954053603112698,
      "epoch": 2.7314285714285713,
      "grad_norm": 0.384765625,
      "learning_rate": 2.1311475409836064e-05,
      "loss": 0.15308330059051514,
      "mean_token_accuracy": 0.9334029331803322,
      "num_tokens": 216797.0,
      "step": 120
    },
    {
      "entropy": 0.17652501314878463,
      "epoch": 2.96,
      "grad_norm": 0.328125,
      "learning_rate": 4.918032786885246e-06,
      "loss": 0.1599588632583618,
      "mean_token_accuracy": 0.9297855496406555,
      "num_tokens": 235257.0,
      "step": 130
    }
  ],
  "logging_steps": 10,
  "max_steps": 132,
  "num_input_tokens_seen": 0,
  "num_train_epochs": 3,
  "save_steps": 500,
  "stateful_callbacks": {
    "TrainerControl": {
      "args": {
        "should_epoch_stop": false,
        "should_evaluate": false,
        "should_log": false,
        "should_save": true,
        "should_training_stop": true
      },
      "attributes": {}
    }
  },
  "total_flos": 3243013979332608.0,
  "train_batch_size": 2,
  "trial_name": null,
  "trial_params": null
}

ms-gemma/training/trainingResults.md

(.venv) PS C:\Users\Usuario\Desktop\AITrain\ms-gemma\training> python .\train_lora.py
Loading dataset from ./data/train.jsonl...
Loading model google/gemma-2-2b-it...
W0203 12:19:51.326000 18912 Lib\site-packages\torch\utils\flop_counter.py:29] triton not found; flop counting will not work for triton kernels
Loading weights:   1%|▉                                                                                            | 3/288 [00:00<01:43,  2.75it/s, Materializing param=model.layers.0.mlp.down_proj.weight]C:\Users\Usuario\Desktop\AITrain\ms-gemma\.venv\Lib\site-packages\bitsandbytes\backends\cuda\ops.py:212: FutureWarning: _check_is_size will be removed in a future PyTorch release along with guard_size_oblivious.     Use _check(i >= 0) instead.
  torch._check_is_size(blocksize)
Loading weights: 100%|█████████████████████████████████████████████████████████████████████████████████████████████████████████████| 288/288 [00:03<00:00, 81.24it/s, Materializing param=model.norm.weight]
Applying formatting function to train dataset: 100%|████████████████████████████████████████████████████████████████████████████████████████████████████████████| 350/350 [00:00<00:00, 17439.73 examples/s]
Adding EOS to train dataset: 100%|██████████████████████████████████████████████████████████████████████████████████████████████████████████████████████████████| 350/350 [00:00<00:00, 18084.69 examples/s] 
Tokenizing train dataset: 100%|██████████████████████████████████████████████████████████████████████████████████████████████████████████████████████████████████| 350/350 [00:00<00:00, 3645.69 examples/s]
Truncating train dataset: 100%|████████████████████████████████████████████████████████████████████████████████████████████████████████████████████████████████| 350/350 [00:00<00:00, 172584.81 examples/s] 
Starting training...
The tokenizer has new PAD/BOS/EOS tokens that differ from the model config and generation config. The model config and generation config were aligned accordingly, being updated with the tokenizer's values. Updated tokens: {'eos_token_id': 1}.
{'loss': '3.15', 'grad_norm': '2.219', 'learning_rate': '0.00018', 'entropy': '2.065', 'num_tokens': '1.822e+04', 'mean_token_accuracy': '0.4662', 'epoch': '0.2286'}
{'loss': '1.084', 'grad_norm': '1.289', 'learning_rate': '0.0001852', 'entropy': '1.258', 'num_tokens': '3.646e+04', 'mean_token_accuracy': '0.7754', 'epoch': '0.4571'}                                     
{'loss': '0.4976', 'grad_norm': '1.156', 'learning_rate': '0.0001689', 'entropy': '0.4511', 'num_tokens': '5.477e+04', 'mean_token_accuracy': '0.872', 'epoch': '0.6857'}                                    
{'loss': '0.2939', 'grad_norm': '0.9766', 'learning_rate': '0.0001525', 'entropy': '0.2593', 'num_tokens': '7.276e+04', 'mean_token_accuracy': '0.914', 'epoch': '0.9143'}                                   
{'loss': '0.2401', 'grad_norm': '0.6875', 'learning_rate': '0.0001361', 'entropy': '0.2149', 'num_tokens': '9.019e+04', 'mean_token_accuracy': '0.9221', 'epoch': '1.137'}                                   
{'loss': '0.2125', 'grad_norm': '0.4883', 'learning_rate': '0.0001197', 'entropy': '0.2053', 'num_tokens': '1.087e+05', 'mean_token_accuracy': '0.923', 'epoch': '1.366'}                                    
{'loss': '0.1933', 'grad_norm': '0.4688', 'learning_rate': '0.0001033', 'entropy': '0.1973', 'num_tokens': '1.272e+05', 'mean_token_accuracy': '0.9203', 'epoch': '1.594'}                                   
{'loss': '0.179', 'grad_norm': '0.4043', 'learning_rate': '8.689e-05', 'entropy': '0.1982', 'num_tokens': '1.454e+05', 'mean_token_accuracy': '0.9284', 'epoch': '1.823'}                                    
{'loss': '0.1635', 'grad_norm': '0.4141', 'learning_rate': '7.049e-05', 'entropy': '0.1855', 'num_tokens': '1.626e+05', 'mean_token_accuracy': '0.9328', 'epoch': '2.046'}                                   
{'loss': '0.1636', 'grad_norm': '0.418', 'learning_rate': '5.41e-05', 'entropy': '0.1842', 'num_tokens': '1.81e+05', 'mean_token_accuracy': '0.9296', 'epoch': '2.274'}                                      
{'loss': '0.1589', 'grad_norm': '0.3652', 'learning_rate': '3.77e-05', 'entropy': '0.1763', 'num_tokens': '1.991e+05', 'mean_token_accuracy': '0.9322', 'epoch': '2.503'}                                    
{'loss': '0.1531', 'grad_norm': '0.3848', 'learning_rate': '2.131e-05', 'entropy': '0.1695', 'num_tokens': '2.168e+05', 'mean_token_accuracy': '0.9334', 'epoch': '2.731'}                                   
{'loss': '0.16', 'grad_norm': '0.3281', 'learning_rate': '4.918e-06', 'entropy': '0.1765', 'num_tokens': '2.353e+05', 'mean_token_accuracy': '0.9298', 'epoch': '2.96'}                                      
{'train_runtime': '296.9', 'train_samples_per_second': '3.537', 'train_steps_per_second': '0.445', 'train_loss': '0.5062', 'entropy': '0.1821', 'num_tokens': '2.386e+05', 'mean_token_accuracy': '0.9303', 'epoch': '3'}
100%|█████████████████████████████████████████████████████████████████████████████████████████████████████████████████████████████████████████████████████████████████████| 132/132 [04:56<00:00,  2.25s/it] 
Saving model to ../models/gemma_lora_output...
Training complete!